titles,links,published
Sanofi drives digital transformation with Google Cloud,https://cloud.google.com/blog/topics/customers/sanofi-drives-digital-transformation-with-google-cloud/,"Tue, 18 Jun 2019 05:00:00 -0000"
"5 cloud sessions from Google I/O '19, from basic to advanced",https://cloud.google.com/blog/topics/events/5-cloud-sessions-from-google-io-19-from-basic-to-advanced/,"Mon, 17 Jun 2019 18:30:00 -0000"
"G Suite collaboration, for Dropbox users",https://cloud.google.com/blog/topics/partners/g-suite-collaboration-for-dropbox-users/,"Mon, 17 Jun 2019 17:00:00 -0000"
Committed use discounts at a glance: New report shows your Compute Engine usage and commitments,https://cloud.google.com/blog/products/compute/new-report-shows-your-compute-engine-usage-and-commitments/,"Mon, 17 Jun 2019 16:00:00 -0000"
3 cool Cloud Run features that developers love,https://cloud.google.com/blog/products/serverless/3-cool-cloud-run-features-that-developers-love-and-that-you-will-too/,"Mon, 17 Jun 2019 16:00:00 -0000"
Getting started with time-series trend predictions using GCP,https://cloud.google.com/blog/products/databases/getting-started-with-time-series-trend-predictions-using-gcp/,"Mon, 17 Jun 2019 16:00:00 -0000"
How to run evolution strategies on Google Kubernetes Engine,https://cloud.google.com/blog/products/ai-machine-learning/how-to-run-evolution-strategies-on-google-kubernetes-engine/,"Mon, 17 Jun 2019 16:00:00 -0000"
3 steps to gain business value from AI,https://cloud.google.com/blog/products/ai-machine-learning/3-steps-to-gain-business-value-from-ai/,"Fri, 14 Jun 2019 16:00:00 -0000"
Leroy Merlin: Transforming the Russian home improvement market with APIs,https://cloud.google.com/blog/topics/customers/leroy-merlin-transforming-the-russian-home-improvement-market-with-apis/,"Thu, 13 Jun 2019 16:30:00 -0000"
Sharing enthusiasm from the cloud community for our Looker acquisition,https://cloud.google.com/blog/topics/inside-google-cloud/sharing-enthusiasm-from-the-cloud-community-for-our-looker-acquisition/,"Thu, 13 Jun 2019 16:00:00 -0000"
Not all collaboration is equal—here’s what it looks like in G Suite,https://cloud.google.com/blog/products/productivity-collaboration/not-all-collaboration-is-equal-heres-what-it-looks-like-in-g-suite/,"Thu, 13 Jun 2019 16:00:00 -0000"
Building hybrid blockchain/cloud applications with Ethereum and Google Cloud,https://cloud.google.com/blog/products/data-analytics/building-hybrid-blockchain-cloud-applications-with-ethereum-and-google-cloud/,"Thu, 13 Jun 2019 16:00:00 -0000"
Google Cloud networking in depth: How Andromeda 2.2 enables high-throughput VMs,https://cloud.google.com/blog/products/networking/google-cloud-networking-in-depth-how-andromeda-2-2-enables-high-throughput-vms/,"Wed, 12 Jun 2019 16:00:00 -0000"
Are you up for the challenge? Get Google Cloud Certified in 3 months,https://cloud.google.com/blog/topics/training-certifications/get-google-cloud-certified-in-3-months/,"Wed, 12 Jun 2019 16:00:00 -0000"
Jupyter Notebook Manifesto: Best practices that can improve the life of any developer using Jupyter notebooks,https://cloud.google.com/blog/products/ai-machine-learning/best-practices-that-can-improve-the-life-of-any-developer-using-jupyter-notebooks/,"Wed, 12 Jun 2019 16:00:00 -0000"
